17:37:53.086673 vxlan0 B   ARP, Request who-has 10.10.0.20 tell 10.10.0.30, length 28
17:37:53.086673 br-vxlan B   ARP, Request who-has 10.10.0.20 tell 10.10.0.30, length 28
17:37:53.086711 vethe0d5136 Out ARP, Request who-has 10.10.0.20 tell 10.10.0.30, length 28
17:37:53.086726 vethe0d5136 P   ARP, Reply 10.10.0.20 is-at aa:4a:1c:71:b3:d2, length 28
17:37:53.086728 vxlan0 Out ARP, Reply 10.10.0.20 is-at aa:4a:1c:71:b3:d2, length 28
17:37:53.088210 vxlan0 P   IP 10.10.0.30.43454 > 10.10.0.20.80: Flags [S], seq 3774206624, win 32120, options [mss 1460,sackOK,TS val 2390849610 ecr 0,nop,wscale 7], length 0
17:37:53.088239 vethe0d5136 Out IP 10.10.0.30.43454 > 10.10.0.20.80: Flags [S], seq 3774206624, win 32120, options [mss 1460,sackOK,TS val 2390849610 ecr 0,nop,wscale 7], length 0
17:37:53.088261 vethe0d5136 P   IP 10.10.0.20.80 > 10.10.0.30.43454: Flags [S.], seq 3544058415, ack 3774206625, win 31856, options [mss 1460,sackOK,TS val 760360036 ecr 2390849610,nop,wscale 7], length 0
17:37:53.088263 vxlan0 Out IP 10.10.0.20.80 > 10.10.0.30.43454: Flags [S.], seq 3544058415, ack 3774206625, win 31856, options [mss 1460,sackOK,TS val 760360036 ecr 2390849610,nop,wscale 7], length 0
17:37:53.089515 vxlan0 P   IP 10.10.0.30.43454 > 10.10.0.20.80: Flags [.], ack 1, win 251, options [nop,nop,TS val 2390849612 ecr 760360036], length 0
17:37:53.089515 vxlan0 P   IP 10.10.0.30.43454 > 10.10.0.20.80: Flags [P.], seq 1:75, ack 1, win 251, options [nop,nop,TS val 2390849613 ecr 760360036], length 74: HTTP: GET / HTTP/1.1
17:37:53.089528 vethe0d5136 Out IP 10.10.0.30.43454 > 10.10.0.20.80: Flags [.], ack 1, win 251, options [nop,nop,TS val 2390849612 ecr 760360036], length 0
17:37:53.089531 vethe0d5136 Out IP 10.10.0.30.43454 > 10.10.0.20.80: Flags [P.], seq 1:75, ack 1, win 251, options [nop,nop,TS val 2390849613 ecr 760360036], length 74: HTTP: GET / HTTP/1.1
17:37:53.089563 vethe0d5136 P   IP 10.10.0.20.80 > 10.10.0.30.43454: Flags [.], ack 75, win 249, options [nop,nop,TS val 760360037 ecr 2390849613], length 0
17:37:53.089565 vxlan0 Out IP 10.10.0.20.80 > 10.10.0.30.43454: Flags [.], ack 75, win 249, options [nop,nop,TS val 760360037 ecr 2390849613], length 0
17:37:53.089728 vethe0d5136 P   IP 10.10.0.20.80 > 10.10.0.30.43454: Flags [P.], seq 1:239, ack 75, win 249, options [nop,nop,TS val 760360037 ecr 2390849613], length 238: HTTP: HTTP/1.1 200 OK
17:37:53.089731 vxlan0 Out IP 10.10.0.20.80 > 10.10.0.30.43454: Flags [P.], seq 1:239, ack 75, win 249, options [nop,nop,TS val 760360037 ecr 2390849613], length 238: HTTP: HTTP/1.1 200 OK
17:37:53.089794 vethe0d5136 P   IP 10.10.0.20.80 > 10.10.0.30.43454: Flags [P.], seq 239:854, ack 75, win 249, options [nop,nop,TS val 760360037 ecr 2390849613], length 615: HTTP
17:37:53.089796 vxlan0 Out IP 10.10.0.20.80 > 10.10.0.30.43454: Flags [P.], seq 239:854, ack 75, win 249, options [nop,nop,TS val 760360037 ecr 2390849613], length 615: HTTP
17:37:53.090432 vxlan0 P   IP 10.10.0.30.43454 > 10.10.0.20.80: Flags [.], ack 239, win 250, options [nop,nop,TS val 2390849614 ecr 760360037], length 0
17:37:53.090441 vethe0d5136 Out IP 10.10.0.30.43454 > 10.10.0.20.80: Flags [.], ack 239, win 250, options [nop,nop,TS val 2390849614 ecr 760360037], length 0
17:37:53.090509 vxlan0 P   IP 10.10.0.30.43454 > 10.10.0.20.80: Flags [.], ack 854, win 246, options [nop,nop,TS val 2390849614 ecr 760360037], length 0
17:37:53.090515 vethe0d5136 Out IP 10.10.0.30.43454 > 10.10.0.20.80: Flags [.], ack 854, win 246, options [nop,nop,TS val 2390849614 ecr 760360037], length 0
17:37:53.090652 vxlan0 P   IP 10.10.0.30.43454 > 10.10.0.20.80: Flags [F.], seq 75, ack 854, win 246, options [nop,nop,TS val 2390849614 ecr 760360037], length 0
17:37:53.090657 vethe0d5136 Out IP 10.10.0.30.43454 > 10.10.0.20.80: Flags [F.], seq 75, ack 854, win 246, options [nop,nop,TS val 2390849614 ecr 760360037], length 0
17:37:53.090690 vethe0d5136 P   IP 10.10.0.20.80 > 10.10.0.30.43454: Flags [F.], seq 854, ack 76, win 249, options [nop,nop,TS val 760360038 ecr 2390849614], length 0
17:37:53.090693 vxlan0 Out IP 10.10.0.20.80 > 10.10.0.30.43454: Flags [F.], seq 854, ack 76, win 249, options [nop,nop,TS val 760360038 ecr 2390849614], length 0
17:37:53.091875 vxlan0 P   IP 10.10.0.30.43454 > 10.10.0.20.80: Flags [.], ack 855, win 246, options [nop,nop,TS val 2390849615 ecr 760360038], length 0
17:37:53.091887 vethe0d5136 Out IP 10.10.0.30.43454 > 10.10.0.20.80: Flags [.], ack 855, win 246, options [nop,nop,TS val 2390849615 ecr 760360038], length 0
17:37:58.556354 vethe0d5136 P   ARP, Request who-has 10.10.0.30 tell 10.10.0.20, length 28
17:37:58.556375 vxlan0 Out ARP, Request who-has 10.10.0.30 tell 10.10.0.20, length 28
17:37:58.557953 vxlan0 P   ARP, Reply 10.10.0.30 is-at 6a:eb:62:83:dc:60, length 28
17:37:58.557969 vethe0d5136 Out ARP, Reply 10.10.0.30 is-at 6a:eb:62:83:dc:60, length 28
